{
  "schema_version": 1,
  "corpus_id": "trusted-import-first-party-v0-1",
  "status": "collecting",
  "created_at": "2026-07-14",
  "targets": {
    "source_apps": 3,
    "cases_per_source": 20,
    "development_per_source": 10,
    "validation_per_source": 5,
    "test_per_source": 5,
    "candidate_layout": "position-encoded-3x3",
    "input_kind": "digital-screenshot"
  },
  "cases": []
}
